{
  "$schema": "https://json-schema.org/draft/2020-12/schema",
  "$id": "flow-a/regime-b-spec/1.0",
  "title": "Regime B generic content-block spec",
  "description": "IR for Regime B (content-dependent blocks). Replaces the closed levels[]+styles{}+body_block_grammar model with an OPEN-VOCABULARY clusters[] model. Two invariants make it generic, not if-else (docs/19 s1): (a) role_label is a free string DISCOVERED per document, never an enum; (b) every block maps to exactly one cluster, and every cluster has a build_action, so the mapping is TOTAL with a raw_fallback default — unknown blocks are carried, never dropped.",
  "type": "object",
  "required": ["source", "clusters", "coverage"],
  "additionalProperties": false,
  "properties": {
    "$schemaVersion": { "const": "flow-a/regime-b-spec/1.0" },
    "source": { "type": "string", "description": "Origin docx filename." },
    "confidence": { "type": "number", "minimum": 0, "maximum": 1 },
    "anomalies": { "type": "array", "items": { "type": "string" } },

    "evidence": {
      "type": "object",
      "description": "Provenance of the two evidence sources merged into this spec.",
      "additionalProperties": false,
      "properties": {
        "probe": { "type": "string", "description": "e.g. evals/probe2.lua (pandoc block sequence + inline signals)." },
        "style_catalog_source": { "type": "string", "description": "e.g. officecli (recovers align/indent/tabs pandoc drops)." },
        "blocks_probed": { "type": "integer", "minimum": 0 }
      }
    },

    "style_catalog": {
      "type": "object",
      "description": "Style definitions keyed by styleId, sourced from officecli (NOT pandoc). Carries the fields pandoc's docx reader drops — align, first-line/left indent, tabs, spacing — so a cluster's typed build_action can reproduce them. Joined to clusters by styleId.",
      "additionalProperties": {
        "type": "object",
        "additionalProperties": true,
        "properties": {
          "align": { "type": "string" },
          "firstLineIndent": { "type": "string" },
          "leftIndent": { "type": "string" },
          "size": { "type": "string" },
          "bold": { "type": "boolean" },
          "italic": { "type": "boolean" },
          "tabs": { "type": "array" }
        }
      }
    },

    "clusters": {
      "type": "array",
      "minItems": 1,
      "items": { "$ref": "#/$defs/cluster" }
    },

    "coverage": {
      "type": "object",
      "required": ["blocks_total", "blocks_assigned", "ratio"],
      "additionalProperties": false,
      "description": "Totality guarantee. ratio MUST be 1.0: raw_fallback is the default cluster, so no block is left unassigned (docs/19 tru (b)).",
      "properties": {
        "blocks_total": { "type": "integer", "minimum": 0 },
        "blocks_assigned": { "type": "integer", "minimum": 0 },
        "ratio": { "type": "number", "minimum": 0, "maximum": 1 }
      }
    }
  },

  "$defs": {
    "signature": {
      "type": "object",
      "description": "NON-SEMANTIC presentation signature (docs/19 s2.1). The secondary cluster key, used when styleId is absent (direct-format docs). Deliberately excludes the meaning of style names.",
      "additionalProperties": false,
      "properties": {
        "styleId":   { "type": ["string", "null"] },
        "bold":      { "type": "boolean" },
        "italic":    { "type": "boolean" },
        "allcaps":   { "type": "boolean" },
        "len_bucket": { "type": "string", "enum": ["empty", "short", "medium", "long"] },
        "has_num":   { "type": "boolean" },
        "has_image": { "type": "boolean" },
        "has_math":  { "type": "boolean" },
        "has_link":  { "type": "boolean" }
      }
    },

    "cluster": {
      "type": "object",
      "required": ["id", "cluster_key", "role_label", "build_action", "members"],
      "additionalProperties": false,
      "properties": {
        "id": { "type": "string", "pattern": "^C[0-9]+$" },

        "cluster_key": {
          "type": "string",
          "enum": ["styleId", "signature"],
          "description": "Which key gathered this cluster. styleId = the author's own pre-made grouping (primary); signature = format-signature fallback for direct-format blocks."
        },

        "styleId": { "type": ["string", "null"] },
        "signature": { "$ref": "#/$defs/signature" },

        "role_label": {
          "type": "string",
          "minLength": 1,
          "description": "OPEN VOCABULARY. A free-text role the agent DISCOVERS and names from evidence (e.g. 'chapter-heading', 'figure-caption', 'reference-entry', or a wholly NEW label). NOT constrained to an enum — that openness is what makes the system generic rather than if-else. Use 'unclassified' when no confident role emerges (paired with a raw_fallback build_action)."
        },

        "confidence": { "type": "number", "minimum": 0, "maximum": 1 },

        "target_style": {
          "type": ["string", "null"],
          "description": "styleId to APPLY when building a member of this cluster on the typed path. Null when the cluster is carried verbatim (raw_fallback)."
        },

        "context_rule": {
          "type": ["string", "null"],
          "description": "Human-readable structural context that disambiguates the role, e.g. 'follows an image => caption', 'top-level, starts a chapter'. Derived from block order, not hardcoded per type."
        },

        "frequency": { "type": "integer", "minimum": 0 },
        "members": {
          "type": "array",
          "items": { "type": "integer", "minimum": 1 },
          "description": "Block indices (probe row `i`) belonging to this cluster."
        },
        "examples": { "type": "array", "items": { "type": "string" } },

        "build_action": {
          "type": "object",
          "required": ["mode"],
          "additionalProperties": false,
          "description": "How a member is materialised on build. This is the TOTAL mapping's payload: typed clusters take the typed path; everything else falls to raw_fallback with an explicit tier.",
          "properties": {
            "mode": {
              "type": "string",
              "enum": ["typed", "raw_fallback"],
              "description": "typed = apply target_style + pour content. raw_fallback = carry the source OOXML verbatim (default branch — the anti-if-else guarantee)."
            },
            "fallback_tier": {
              "type": ["string", "null"],
              "enum": ["build-on-copy", "dump-replay", "raw-splice", null],
              "description": "Only for mode=raw_fallback. Ordered by dependency-robustness (docs/20 s4): build-on-copy (keeps all parts+rels; safest) > dump-replay (officecli, structure-aware) > raw-splice (needs safe-placement + dependency-closure)."
            },
            "needs_dep_closure": {
              "type": "boolean",
              "description": "True when the block references another part (hyperlink->rels, image->media, chart->xlsx). A raw-splice of such a block MUST copy the dependency closure or it dangles (the rId8 lesson, docs/19 s2.2)."
            }
          }
        }
      }
    }
  }
}
